{"schema":"runtime-bank-content@1","chunk_id":"middle_grade-1_science-01","kind":"content","items":[{"key":"q-m1-science-3b96fc064f","revision":1,"type":"mcq","language":"ar","stem":"سؤال s5؟","stimulus":null,"public":{"options":[{"id":"o8cc9bd","text":"1"},{"id":"o5eaa32","text":"2"},{"id":"o9905e7","text":"3"},{"id":"o662a5f","text":"4"}],"fixed_order_reason":null},"shuffle_options":true,"fixed_order_reason":null,"time_limit_seconds":60,"band":1,"lesson":{"id":"middle/grade-1/science/xa3e7e839","title":"الخواص الفيزيائية","term":null},"topic":null},{"key":"q-m1-science-41242b9fae","revision":1,"type":"short_answer","language":"ar","stem":"سؤال s3؟","stimulus":null,"public":{"max_chars":20},"shuffle_options":false,"fixed_order_reason":null,"time_limit_seconds":60,"band":2,"lesson":{"id":"middle/grade-1/science/xe389fa43","title":"الذرات والعناصر","term":null},"topic":null},{"key":"q-m1-science-5b840157e7","revision":1,"type":"mcq","language":"ar","stem":"سؤال s4؟","stimulus":null,"public":{"options":[{"id":"o8c04bc","text":"نواة"},{"id":"ocb92fb","text":"جدار"},{"id":"o6e29ec","text":"غشاء"},{"id":"od8c85e","text":"سيتوبلازم"}],"fixed_order_reason":null},"shuffle_options":true,"fixed_order_reason":null,"time_limit_seconds":60,"band":3,"lesson":{"id":"middle/grade-1/science/xe389fa43","title":"الذرات والعناصر","term":null},"topic":null},{"key":"q-m1-science-ad328846aa","revision":1,"type":"true_false","language":"ar","stem":"سؤال s2؟","stimulus":null,"public":{"options":[{"id":"t","text":"صح"},{"id":"f","text":"خطأ"}],"fixed_order_reason":null},"shuffle_options":false,"fixed_order_reason":null,"time_limit_seconds":60,"band":2,"lesson":{"id":"middle/grade-1/science/xc241a07b","title":"المركبات والمخاليط","term":"t1"},"topic":null},{"key":"q-m1-science-e8bc163c82","revision":1,"type":"mcq","language":"ar","stem":"سؤال s1؟","stimulus":null,"public":{"options":[{"id":"oc4c4b9","text":"ماء"},{"id":"o806f94","text":"هواء"},{"id":"o1152b1","text":"تراب"},{"id":"oc7331a","text":"نار"}],"fixed_order_reason":null},"shuffle_options":true,"fixed_order_reason":null,"time_limit_seconds":60,"band":1,"lesson":{"id":"middle/grade-1/science/xc241a07b","title":"المركبات والمخاليط","term":"t1"},"topic":null}]}
