{"schema":"runtime-bank-content@1","chunk_id":"aptitude_verbal-01","kind":"keys","items":[{"key":"av-101","revision":1,"payload":{"options":[{"id":"oce5a3a","text":"قلم : كتابة"},{"id":"o1eacd5","text":"باب : جدار"},{"id":"offdbfa","text":"شمس : قمر"},{"id":"ofca392","text":"ماء : نار"}],"answer":{"option_id":"oce5a3a"},"fixed_order_reason":null},"explanation":{"text":"شرح av-101.","steps":[]},"objective":null,"source":null},{"key":"av-102","revision":1,"payload":{"options":[{"id":"oc7d7f9","text":"طبيب : مستشفى"},{"id":"o5a598a","text":"معلم : سبورة"},{"id":"oa91448","text":"طالب : قلم"},{"id":"oe14c21","text":"نجار : خشب"}],"answer":{"option_id":"oc7d7f9"},"fixed_order_reason":null},"explanation":{"text":"شرح av-102.","steps":[]},"objective":null,"source":null},{"key":"av-103","revision":1,"payload":{"options":[{"id":"oa23a2c","text":"ليل : نهار"},{"id":"ob86553","text":"حار : ساخن"},{"id":"of9d99f","text":"كبير : ضخم"},{"id":"o318249","text":"سريع : عاجل"}],"answer":{"option_id":"oa23a2c"},"fixed_order_reason":null},"explanation":{"text":"شرح av-103.","steps":[]},"objective":null,"source":null},{"key":"av-104","revision":1,"payload":{"options":[{"id":"o2bad0c","text":"ورقة : شجرة"},{"id":"od7eca6","text":"صفحة : كتاب"},{"id":"o310ba6","text":"باب : بيت"},{"id":"oabcba7","text":"حبر : قلم"}],"answer":{"option_id":"od7eca6"},"fixed_order_reason":null},"explanation":{"text":"شرح av-104.","steps":[]},"objective":null,"source":null},{"key":"av-105","revision":1,"payload":{"options":[{"id":"o89bbe4","text":"الكلمة الأولى"},{"id":"obedc23","text":"الكلمة الثانية"},{"id":"o37fdf5","text":"الكلمة الثالثة"},{"id":"o992f63","text":"الكلمة الرابعة"}],"answer":{"option_id":"o37fdf5"},"fixed_order_reason":null},"explanation":{"text":"شرح av-105.","steps":[]},"objective":null,"source":null},{"key":"av-106","revision":1,"payload":{"options":[{"id":"o08392f","text":"الكلمة الأولى"},{"id":"o7c2c50","text":"الكلمة الثانية"},{"id":"o33ab7d","text":"الكلمة الثالثة"},{"id":"o14668d","text":"الكلمة الرابعة"}],"answer":{"option_id":"o08392f"},"fixed_order_reason":null},"explanation":{"text":"شرح av-106.","steps":[]},"objective":null,"source":null},{"key":"av-107","revision":1,"payload":{"options":[{"id":"oaa2e7c","text":"الكلمة الأولى"},{"id":"o9a23c5","text":"الكلمة الثانية"},{"id":"o17ec0a","text":"الكلمة الثالثة"},{"id":"odc903b","text":"الكلمة الرابعة"}],"answer":{"option_id":"odc903b"},"fixed_order_reason":null},"explanation":{"text":"شرح av-107.","steps":[]},"objective":null,"source":null},{"key":"av-108","revision":1,"payload":{"options":[{"id":"ob48db2","text":"تفاح"},{"id":"oa6266a","text":"موز"},{"id":"o2fc966","text":"جزر"},{"id":"ofc5e0d","text":"عنب"}],"answer":{"option_id":"o2fc966"},"fixed_order_reason":null},"explanation":{"text":"شرح av-108.","steps":[]},"objective":null,"source":null},{"key":"av-109","revision":1,"payload":{"options":[{"id":"ofc6aa4","text":"أسد"},{"id":"o07f31e","text":"نمر"},{"id":"o9a7eb1","text":"فهد"},{"id":"ob2faa3","text":"حمامة"}],"answer":{"option_id":"ob2faa3"},"fixed_order_reason":null},"explanation":{"text":"شرح av-109.","steps":[]},"objective":null,"source":null}]}
