{"schema":"runtime-bank-content@1","chunk_id":"aptitude_verbal-01","kind":"content","items":[{"key":"av-101","revision":1,"type":"mcq","language":"ar","stem":"سؤال av-101؟","stimulus":null,"public":{"options":[{"id":"oce5a3a","text":"قلم : كتابة"},{"id":"o1eacd5","text":"باب : جدار"},{"id":"offdbfa","text":"شمس : قمر"},{"id":"ofca392","text":"ماء : نار"}],"fixed_order_reason":null},"shuffle_options":true,"fixed_order_reason":null,"time_limit_seconds":60,"band":1,"lesson":{"id":"prep:aptitude/verbal/analogy","title":null,"term":null},"topic":"analogy"},{"key":"av-102","revision":1,"type":"mcq","language":"ar","stem":"سؤال av-102؟","stimulus":null,"public":{"options":[{"id":"oc7d7f9","text":"طبيب : مستشفى"},{"id":"o5a598a","text":"معلم : سبورة"},{"id":"oa91448","text":"طالب : قلم"},{"id":"oe14c21","text":"نجار : خشب"}],"fixed_order_reason":null},"shuffle_options":true,"fixed_order_reason":null,"time_limit_seconds":60,"band":2,"lesson":{"id":"prep:aptitude/verbal/analogy","title":null,"term":null},"topic":"analogy"},{"key":"av-103","revision":1,"type":"mcq","language":"ar","stem":"سؤال av-103؟","stimulus":null,"public":{"options":[{"id":"oa23a2c","text":"ليل : نهار"},{"id":"ob86553","text":"حار : ساخن"},{"id":"of9d99f","text":"كبير : ضخم"},{"id":"o318249","text":"سريع : عاجل"}],"fixed_order_reason":null},"shuffle_options":true,"fixed_order_reason":null,"time_limit_seconds":60,"band":2,"lesson":{"id":"prep:aptitude/verbal/analogy","title":null,"term":null},"topic":"analogy"},{"key":"av-104","revision":1,"type":"mcq","language":"ar","stem":"سؤال av-104؟","stimulus":null,"public":{"options":[{"id":"o2bad0c","text":"ورقة : شجرة"},{"id":"od7eca6","text":"صفحة : كتاب"},{"id":"o310ba6","text":"باب : بيت"},{"id":"oabcba7","text":"حبر : قلم"}],"fixed_order_reason":null},"shuffle_options":true,"fixed_order_reason":null,"time_limit_seconds":60,"band":3,"lesson":{"id":"prep:aptitude/verbal/analogy","title":null,"term":null},"topic":"analogy"},{"key":"av-105","revision":1,"type":"mcq","language":"ar","stem":"سؤال av-105؟","stimulus":null,"public":{"options":[{"id":"o89bbe4","text":"الكلمة الأولى"},{"id":"obedc23","text":"الكلمة الثانية"},{"id":"o37fdf5","text":"الكلمة الثالثة"},{"id":"o992f63","text":"الكلمة الرابعة"}],"fixed_order_reason":null},"shuffle_options":true,"fixed_order_reason":null,"time_limit_seconds":60,"band":1,"lesson":{"id":"prep:aptitude/verbal/contextual-error","title":null,"term":null},"topic":"contextual-error"},{"key":"av-106","revision":1,"type":"mcq","language":"ar","stem":"سؤال av-106؟","stimulus":null,"public":{"options":[{"id":"o08392f","text":"الكلمة الأولى"},{"id":"o7c2c50","text":"الكلمة الثانية"},{"id":"o33ab7d","text":"الكلمة الثالثة"},{"id":"o14668d","text":"الكلمة الرابعة"}],"fixed_order_reason":null},"shuffle_options":true,"fixed_order_reason":null,"time_limit_seconds":60,"band":2,"lesson":{"id":"prep:aptitude/verbal/contextual-error","title":null,"term":null},"topic":"contextual-error"},{"key":"av-107","revision":1,"type":"mcq","language":"ar","stem":"سؤال av-107؟","stimulus":null,"public":{"options":[{"id":"oaa2e7c","text":"الكلمة الأولى"},{"id":"o9a23c5","text":"الكلمة الثانية"},{"id":"o17ec0a","text":"الكلمة الثالثة"},{"id":"odc903b","text":"الكلمة الرابعة"}],"fixed_order_reason":null},"shuffle_options":true,"fixed_order_reason":null,"time_limit_seconds":60,"band":3,"lesson":{"id":"prep:aptitude/verbal/contextual-error","title":null,"term":null},"topic":"contextual-error"},{"key":"av-108","revision":1,"type":"mcq","language":"ar","stem":"سؤال av-108؟","stimulus":null,"public":{"options":[{"id":"ob48db2","text":"تفاح"},{"id":"oa6266a","text":"موز"},{"id":"o2fc966","text":"جزر"},{"id":"ofc5e0d","text":"عنب"}],"fixed_order_reason":null},"shuffle_options":true,"fixed_order_reason":null,"time_limit_seconds":60,"band":1,"lesson":{"id":"prep:aptitude/verbal/odd-word-out","title":null,"term":null},"topic":"odd-word-out"},{"key":"av-109","revision":1,"type":"mcq","language":"ar","stem":"سؤال av-109؟","stimulus":null,"public":{"options":[{"id":"ofc6aa4","text":"أسد"},{"id":"o07f31e","text":"نمر"},{"id":"o9a7eb1","text":"فهد"},{"id":"ob2faa3","text":"حمامة"}],"fixed_order_reason":null},"shuffle_options":true,"fixed_order_reason":null,"time_limit_seconds":60,"band":2,"lesson":{"id":"prep:aptitude/verbal/odd-word-out","title":null,"term":null},"topic":"odd-word-out"}]}
