{"schema":"runtime-bank-content@1","chunk_id":"middle_grade-1_science-01","kind":"keys","items":[{"key":"q-m1-science-3b96fc064f","revision":1,"payload":{"options":[{"id":"o8cc9bd","text":"1"},{"id":"o5eaa32","text":"2"},{"id":"o9905e7","text":"3"},{"id":"o662a5f","text":"4"}],"answer":{"option_id":"o8cc9bd"},"fixed_order_reason":null},"explanation":{"text":"شرح s5.","steps":["خطوة s5"]},"objective":null,"source":{"resource_id":"ien-120607","title":"مقرر الرياضيات /كتاب الطالب الجزء الأول","printed_start":12,"printed_end":13,"url":"https://iencontent.ien.edu.sa/books/1448-GE-ME-K07-SM1-math-part1.pdf#page=14"}},{"key":"q-m1-science-41242b9fae","revision":1,"payload":{"accepted":["خلية"],"match":"normalized_exact","max_chars":20,"answer_display":"خلية"},"explanation":{"text":"شرح s3.","steps":["خطوة s3"]},"objective":null,"source":{"resource_id":"ien-120607","title":"مقرر الرياضيات /كتاب الطالب الجزء الأول","printed_start":12,"printed_end":13,"url":"https://iencontent.ien.edu.sa/books/1448-GE-ME-K07-SM1-math-part1.pdf#page=14"}},{"key":"q-m1-science-5b840157e7","revision":1,"payload":{"options":[{"id":"o8c04bc","text":"نواة"},{"id":"ocb92fb","text":"جدار"},{"id":"o6e29ec","text":"غشاء"},{"id":"od8c85e","text":"سيتوبلازم"}],"answer":{"option_id":"o8c04bc"},"fixed_order_reason":null},"explanation":{"text":"شرح s4.","steps":["خطوة s4"]},"objective":null,"source":{"resource_id":"ien-120607","title":"مقرر الرياضيات /كتاب الطالب الجزء الأول","printed_start":12,"printed_end":13,"url":"https://iencontent.ien.edu.sa/books/1448-GE-ME-K07-SM1-math-part1.pdf#page=14"}},{"key":"q-m1-science-ad328846aa","revision":1,"payload":{"options":[{"id":"t","text":"صح"},{"id":"f","text":"خطأ"}],"answer":{"option_id":"t"},"fixed_order_reason":null},"explanation":{"text":"شرح s2.","steps":["خطوة s2"]},"objective":null,"source":{"resource_id":"ien-120607","title":"مقرر الرياضيات /كتاب الطالب الجزء الأول","printed_start":12,"printed_end":13,"url":"https://iencontent.ien.edu.sa/books/1448-GE-ME-K07-SM1-math-part1.pdf#page=14"}},{"key":"q-m1-science-e8bc163c82","revision":1,"payload":{"options":[{"id":"oc4c4b9","text":"ماء"},{"id":"o806f94","text":"هواء"},{"id":"o1152b1","text":"تراب"},{"id":"oc7331a","text":"نار"}],"answer":{"option_id":"oc4c4b9"},"fixed_order_reason":null},"explanation":{"text":"شرح s1.","steps":["خطوة s1"]},"objective":null,"source":{"resource_id":"ien-120607","title":"مقرر الرياضيات /كتاب الطالب الجزء الأول","printed_start":12,"printed_end":13,"url":"https://iencontent.ien.edu.sa/books/1448-GE-ME-K07-SM1-math-part1.pdf#page=14"}}]}
